,Gene_set,Term,Overlap,P-value,Adjusted P-value,Old P-value,Old Adjusted P-value,Odds Ratio,Combined Score,Genes
721,GO_Biological_Process_2021,negative regulation of protein kinase B signaling (GO:0051898),1/40,0.316254272081253,0.4745995145164183,0,0,2.696672122204037,3.1044324903080134,MAGI2
722,GO_Biological_Process_2021,nucleocytoplasmic transport (GO:0006913),1/40,0.316254272081253,0.4745995145164183,0,0,2.696672122204037,3.1044324903080134,ATXN1
723,GO_Biological_Process_2021,positive regulation of intrinsic apoptotic signaling pathway (GO:2001244),1/40,0.316254272081253,0.4745995145164183,0,0,2.696672122204037,3.1044324903080134,BCL2
724,GO_Biological_Process_2021,intraciliary transport involved in cilium assembly (GO:0035735),1/40,0.316254272081253,0.4745995145164183,0,0,2.696672122204037,3.1044324903080134,DYNC2LI1
725,GO_Biological_Process_2021,regulation of mitochondrial membrane potential (GO:0051881),1/41,0.3227286075001341,0.4829831154885088,0,0,2.629122340425532,2.973388909431432,BCL2
726,GO_Biological_Process_2021,JNK cascade (GO:0007254),1/41,0.3227286075001341,0.4829831154885088,0,0,2.629122340425532,2.973388909431432,MAP3K7
727,GO_Biological_Process_2021,chemical synaptic transmission (GO:0007268),4/306,0.328193301550309,0.4869412243965544,0,0,1.3967424378020403,1.5561840931691573,CHRM3;STXBP3;NOVA1;CDH8
728,GO_Biological_Process_2021,ATP-dependent chromatin remodeling (GO:0043044),1/42,0.3291419591356655,0.4869412243965544,0,0,2.564867669953295,2.850250581210622,SMARCA2
729,GO_Biological_Process_2021,ceramide biosynthetic process (GO:0046513),1/42,0.3291419591356655,0.4869412243965544,0,0,2.564867669953295,2.850250581210622,ASAH1
730,GO_Biological_Process_2021,nucleic acid-templated transcription (GO:0097659),1/42,0.3291419591356655,0.4869412243965544,0,0,2.564867669953295,2.850250581210622,THRB
731,GO_Biological_Process_2021,heterophilic cell-cell adhesion via plasma membrane cell adhesion molecules (GO:0007157),1/42,0.3291419591356655,0.4869412243965544,0,0,2.564867669953295,2.850250581210622,PTPRD
732,GO_Biological_Process_2021,histone H3 acetylation (GO:0043966),1/42,0.3291419591356655,0.4869412243965544,0,0,2.564867669953295,2.850250581210622,MAP3K7
733,GO_Biological_Process_2021,positive regulation of protein tyrosine kinase activity (GO:0061098),1/42,0.3291419591356655,0.4869412243965544,0,0,2.564867669953295,2.850250581210622,NTRK2
734,GO_Biological_Process_2021,mitochondrial gene expression (GO:0140053),1/42,0.3291419591356655,0.4869412243965544,0,0,2.564867669953295,2.850250581210622,MRPS6
735,GO_Biological_Process_2021,positive regulation of protein modification process (GO:0031401),3/214,0.3294014165035515,0.4869412243965544,0,0,1.4982418590429598,1.6637648643545508,NTRK2;FAM161A;AKTIP
736,GO_Biological_Process_2021,negative regulation of cell growth (GO:0030308),2/126,0.3345419696013373,0.4906161955277787,0,0,1.6980334655856475,1.8593346526660195,CAPRIN2;SMARCA2
737,GO_Biological_Process_2021,negative regulation of growth (GO:0045926),2/126,0.3345419696013373,0.4906161955277787,0,0,1.6980334655856475,1.8593346526660195,CAPRIN2;SMARCA2
738,GO_Biological_Process_2021,negative regulation of type I interferon production (GO:0032480),1/43,0.335494898412378,0.4906161955277787,0,0,2.5036727456940224,2.73438250533161,TAX1BP1
739,GO_Biological_Process_2021,DNA-dependent DNA replication maintenance of fidelity (GO:0045005),1/43,0.335494898412378,0.4906161955277787,0,0,2.5036727456940224,2.73438250533161,MCM9
740,GO_Biological_Process_2021,positive regulation of axonogenesis (GO:0050772),1/43,0.335494898412378,0.4906161955277787,0,0,2.5036727456940224,2.73438250533161,NTRK2
741,GO_Biological_Process_2021,signal release from synapse (GO:0099643),1/43,0.335494898412378,0.4906161955277787,0,0,2.5036727456940224,2.73438250533161,STXBP3
742,GO_Biological_Process_2021,positive regulation of phospholipase C activity (GO:0010863),1/43,0.335494898412378,0.4906161955277787,0,0,2.5036727456940224,2.73438250533161,NTRK2
743,GO_Biological_Process_2021,natural killer cell activation (GO:0030101),1/43,0.335494898412378,0.4906161955277787,0,0,2.5036727456940224,2.73438250533161,SNX27
744,GO_Biological_Process_2021,regulation of endothelial cell apoptotic process (GO:2000351),1/44,0.3417879913863361,0.4951602325277412,0,0,2.4453240969816923,2.625213489652861,NFE2L2
745,GO_Biological_Process_2021,neurotransmitter secretion (GO:0007269),1/44,0.3417879913863361,0.4951602325277412,0,0,2.4453240969816923,2.625213489652861,STXBP3
746,GO_Biological_Process_2021,homotypic cell-cell adhesion (GO:0034109),1/44,0.3417879913863361,0.4951602325277412,0,0,2.4453240969816923,2.625213489652861,STXBP3
747,GO_Biological_Process_2021,positive regulation of mRNA catabolic process (GO:0061014),1/44,0.3417879913863361,0.4951602325277412,0,0,2.4453240969816923,2.625213489652861,TNRC6B
748,GO_Biological_Process_2021,lymphocyte chemotaxis (GO:0048247),1/44,0.3417879913863361,0.4951602325277412,0,0,2.4453240969816923,2.625213489652861,CXCL16
749,GO_Biological_Process_2021,positive regulation of receptor-mediated endocytosis (GO:0048260),1/44,0.3417879913863361,0.4951602325277412,0,0,2.4453240969816923,2.625213489652861,MAGI2
750,GO_Biological_Process_2021,mitotic spindle assembly (GO:0090307),1/44,0.3417879913863361,0.4951602325277412,0,0,2.4453240969816923,2.625213489652861,MAP9
751,GO_Biological_Process_2021,positive regulation of macromolecule biosynthetic process (GO:0010557),2/129,0.3448642368667688,0.4989525129136231,0,0,1.6576697966230156,1.7647626516086876,EPM2AIP1;NAMPT
752,GO_Biological_Process_2021,neural crest cell development (GO:0014032),1/45,0.3480217988046306,0.5012481881553859,0,0,2.389627659574468,2.522228482958168,SEMA6D
753,GO_Biological_Process_2021,positive regulation of nervous system development (GO:0051962),1/45,0.3480217988046306,0.5012481881553859,0,0,2.389627659574468,2.522228482958168,PTPRD
754,GO_Biological_Process_2021,mitotic G2/M transition checkpoint (GO:0044818),1/45,0.3480217988046306,0.5012481881553859,0,0,2.389627659574468,2.522228482958168,TAOK3
755,GO_Biological_Process_2021,protein glycosylation (GO:0006486),2/130,0.3482937777991468,0.5012481881553859,0,0,1.6446356951871657,1.734612013939959,MGAT4A;POMK
756,GO_Biological_Process_2021,alpha-amino acid metabolic process (GO:1901605),1/46,0.3541968763481647,0.5077288556874878,0,0,2.3364066193853428,2.424961973536866,GLS
757,GO_Biological_Process_2021,regulation of B cell proliferation (GO:0030888),1/46,0.3541968763481647,0.5077288556874878,0,0,2.3364066193853428,2.424961973536866,BCL2
758,GO_Biological_Process_2021,positive regulation of nucleocytoplasmic transport (GO:0046824),1/46,0.3541968763481647,0.5077288556874878,0,0,2.3364066193853428,2.424961973536866,EFCAB7
759,GO_Biological_Process_2021,regulation of cell adhesion (GO:0030155),2/133,0.3585459868415123,0.5124462567311214,0,0,1.6067273543699228,1.6480175986237933,PPP3CA;MIA3
760,GO_Biological_Process_2021,transmembrane receptor protein serine/threonine kinase signaling pathway (GO:0007178),2/133,0.3585459868415123,0.5124462567311214,0,0,1.6067273543699228,1.6480175986237933,ADAM9;MAP3K7
761,GO_Biological_Process_2021,negative regulation of cold-induced thermogenesis (GO:0120163),1/47,0.3603137742640697,0.5124462567311214,0,0,2.2854995374653098,2.33299229092702,NOVA1
762,GO_Biological_Process_2021,epidermal growth factor receptor signaling pathway (GO:0007173),1/47,0.3603137742640697,0.5124462567311214,0,0,2.2854995374653098,2.33299229092702,ERBIN
763,GO_Biological_Process_2021,regulation of synapse assembly (GO:0051963),1/47,0.3603137742640697,0.5124462567311214,0,0,2.2854995374653098,2.33299229092702,PTPRD
764,GO_Biological_Process_2021,glycosphingolipid metabolic process (GO:0006687),1/47,0.3603137742640697,0.5124462567311214,0,0,2.2854995374653098,2.33299229092702,ASAH1
765,GO_Biological_Process_2021,negative regulation of MAP kinase activity (GO:0043407),1/48,0.3663730379163756,0.5197051698214038,0,0,2.2367587143503846,2.245936661804606,HIPK3
766,GO_Biological_Process_2021,myelination (GO:0042552),1/48,0.3663730379163756,0.5197051698214038,0,0,2.2367587143503846,2.245936661804606,ADGRG6
767,GO_Biological_Process_2021,protein localization to plasma membrane (GO:0072659),2/136,0.368739639488554,0.5217018566496057,0,0,1.5705164019474818,1.566848410673538,RDX;RAPGEF6
768,GO_Biological_Process_2021,cellular calcium ion homeostasis (GO:0006874),2/136,0.368739639488554,0.5217018566496057,0,0,1.5705164019474818,1.566848410673538,CAV2;BCL2
769,GO_Biological_Process_2021,adherens junction organization (GO:0034332),1/49,0.3723752074302826,0.5254788919379345,0,0,2.1900487588652484,2.1634469174820667,CDH8
770,GO_Biological_Process_2021,regulation of stress-activated MAPK cascade (GO:0032872),1/49,0.3723752074302826,0.5254788919379345,0,0,2.1900487588652484,2.1634469174820667,TAOK3
771,GO_Biological_Process_2021,cellular protein localization (GO:0034613),4/329,0.3774788694767466,0.5304291881010269,0,0,1.2963659043659044,1.2629724089561725,TBCK;RABGAP1L;STXBP3;SNX27
772,GO_Biological_Process_2021,positive regulation of cellular process (GO:0048522),7/625,0.3782885868304508,0.5304291881010269,0,0,1.194485934777197,1.161157289589596,PPP3CA;NTRK2;GRK5;CCPG1;NAMPT;BCL2;CXCL16
773,GO_Biological_Process_2021,actin polymerization or depolymerization (GO:0008154),1/50,0.3783208179838206,0.5304291881010269,0,0,2.1452453321754232,2.085205747179162,TWF1
774,GO_Biological_Process_2021,neuron migration (GO:0001764),1/50,0.3783208179838206,0.5304291881010269,0,0,2.1452453321754232,2.085205747179162,NTRK2
775,GO_Biological_Process_2021,iron ion transport (GO:0006826),1/50,0.3783208179838206,0.5304291881010269,0,0,2.1452453321754232,2.085205747179162,ATP6V1A
776,GO_Biological_Process_2021,protein dephosphorylation (GO:0006470),2/139,0.3788699459919783,0.5305154456103892,0,0,1.5358913306530309,1.4906781966352622,PTPRD;PPP3CA
777,GO_Biological_Process_2021,enzyme linked receptor protein signaling pathway (GO:0007167),2/140,0.3822318552628632,0.5324572043105242,0,0,1.5246841819731844,1.466331321898649,PTPRD;NTRK2
778,GO_Biological_Process_2021,protein localization to cell periphery (GO:1990778),2/140,0.3822318552628632,0.5324572043105242,0,0,1.5246841819731844,1.466331321898649,RDX;RAPGEF6
779,GO_Biological_Process_2021,regulation of axonogenesis (GO:0050770),1/51,0.3842103997133104,0.5324572043105242,0,0,2.102234042553192,2.0109234239301528,NTRK2
780,GO_Biological_Process_2021,DNA duplex unwinding (GO:0032508),1/51,0.3842103997133104,0.5324572043105242,0,0,2.102234042553192,2.0109234239301528,MCM9
781,GO_Biological_Process_2021,intrinsic apoptotic signaling pathway in response to DNA damage (GO:0008630),1/51,0.3842103997133104,0.5324572043105242,0,0,2.102234042553192,2.0109234239301528,BCL2
782,GO_Biological_Process_2021,ameboidal-type cell migration (GO:0001667),1/52,0.3900444777899704,0.5324572043105242,0,0,2.060909470171047,1.9403349327010695,SEMA6D
783,GO_Biological_Process_2021,amide biosynthetic process (GO:0043604),1/52,0.3900444777899704,0.5324572043105242,0,0,2.060909470171047,1.9403349327010695,ASAH1
784,GO_Biological_Process_2021,cartilage development (GO:0051216),1/52,0.3900444777899704,0.5324572043105242,0,0,2.060909470171047,1.9403349327010695,ITGB8
785,GO_Biological_Process_2021,negative regulation of protein-containing complex assembly (GO:0031333),1/52,0.3900444777899704,0.5324572043105242,0,0,2.060909470171047,1.9403349327010695,IMPACT
786,GO_Biological_Process_2021,regulation of intrinsic apoptotic signaling pathway (GO:2001242),1/52,0.3900444777899704,0.5324572043105242,0,0,2.060909470171047,1.9403349327010695,BCL2
787,GO_Biological_Process_2021,endocytic recycling (GO:0032456),1/52,0.3900444777899704,0.5324572043105242,0,0,2.060909470171047,1.9403349327010695,SNX27
788,GO_Biological_Process_2021,plasma membrane bounded cell projection morphogenesis (GO:0120039),1/52,0.3900444777899704,0.5324572043105242,0,0,2.060909470171047,1.9403349327010695,TAOK3
789,GO_Biological_Process_2021,regulation of release of sequestered calcium ion into cytosol (GO:0051279),1/52,0.3900444777899704,0.5324572043105242,0,0,2.060909470171047,1.9403349327010695,PDE4D
790,GO_Biological_Process_2021,positive regulation of developmental growth (GO:0048639),1/52,0.3900444777899704,0.5324572043105242,0,0,2.060909470171047,1.9403349327010695,ITSN2
791,GO_Biological_Process_2021,glycolipid metabolic process (GO:0006664),1/52,0.3900444777899704,0.5324572043105242,0,0,2.060909470171047,1.9403349327010695,ASAH1
792,GO_Biological_Process_2021,response to peptide hormone (GO:0043434),1/52,0.3900444777899704,0.5324572043105242,0,0,2.060909470171047,1.9403349327010695,EPM2AIP1
793,GO_Biological_Process_2021,sprouting angiogenesis (GO:0002040),1/52,0.3900444777899704,0.5324572043105242,0,0,2.060909470171047,1.9403349327010695,MIA3
794,GO_Biological_Process_2021,positive regulation of protein localization to cell periphery (GO:1904377),1/52,0.3900444777899704,0.5324572043105242,0,0,2.060909470171047,1.9403349327010695,EFCAB7
795,GO_Biological_Process_2021,protein homotetramerization (GO:0051289),1/52,0.3900444777899704,0.5324572043105242,0,0,2.060909470171047,1.9403349327010695,GLS
796,GO_Biological_Process_2021,myeloid cell differentiation (GO:0030099),1/52,0.3900444777899704,0.5324572043105242,0,0,2.060909470171047,1.9403349327010695,SNRK
797,GO_Biological_Process_2021,regulation of ERK1 and ERK2 cascade (GO:0070372),3/238,0.3911170913099117,0.5332523751192781,0,0,1.343582704186685,1.2612859761891122,NTRK2;STYX;ZDHHC17
798,GO_Biological_Process_2021,receptor-mediated endocytosis (GO:0006898),2/143,0.3922707870845602,0.5341559653917416,0,0,1.4920165358212918,1.3962333925556445,CAV2;CXCL16
799,GO_Biological_Process_2021,bicellular tight junction assembly (GO:0070830),1/53,0.3958235725596017,0.5361659398181654,0,0,2.0211743044189854,1.873197445207917,PARD6B
800,GO_Biological_Process_2021,positive regulation of B cell activation (GO:0050871),1/53,0.3958235725596017,0.5361659398181654,0,0,2.0211743044189854,1.873197445207917,BCL2
801,GO_Biological_Process_2021,positive regulation of macroautophagy (GO:0016239),1/53,0.3958235725596017,0.5361659398181654,0,0,2.0211743044189854,1.873197445207917,MAP3K7
802,GO_Biological_Process_2021,IRE1-mediated unfolded protein response (GO:0036498),1/53,0.3958235725596017,0.5361659398181654,0,0,2.0211743044189854,1.873197445207917,DNAJC3
803,GO_Biological_Process_2021,axonogenesis (GO:0007409),3/240,0.3962108599391589,0.5361659398181654,0,0,1.3321083435415817,1.2332775402148477,PARD6B;SEMA6D;ZDHHC17
804,GO_Biological_Process_2021,regulation of cellular amino acid metabolic process (GO:0006521),1/54,0.4015481994798117,0.5413685762503533,0,0,1.9829385788839824,1.809288095265265,PPM1K
805,GO_Biological_Process_2021,regulation of megakaryocyte differentiation (GO:0045652),1/54,0.4015481994798117,0.5413685762503533,0,0,1.9829385788839824,1.809288095265265,TNRC6B
806,GO_Biological_Process_2021,regulation of proteasomal protein catabolic process (GO:0061136),1/54,0.4015481994798117,0.5413685762503533,0,0,1.9829385788839824,1.809288095265265,TMTC3
807,GO_Biological_Process_2021,protein sumoylation (GO:0016925),1/55,0.4072188691837333,0.5456331646205687,0,0,1.9461189913317571,1.748402012562394,PIAS2
808,GO_Biological_Process_2021,regulation of cardiac conduction (GO:1903779),1/55,0.4072188691837333,0.5456331646205687,0,0,1.9461189913317571,1.748402012562394,ITPR2
809,GO_Biological_Process_2021,ceramide metabolic process (GO:0006672),1/55,0.4072188691837333,0.5456331646205687,0,0,1.9461189913317571,1.748402012562394,ASAH1
810,GO_Biological_Process_2021,glycoprotein metabolic process (GO:0009100),1/55,0.4072188691837333,0.5456331646205687,0,0,1.9461189913317571,1.748402012562394,MGAT4A
811,GO_Biological_Process_2021,interstrand cross-link repair (GO:0036297),1/55,0.4072188691837333,0.5456331646205687,0,0,1.9461189913317571,1.748402012562394,MCM9
812,GO_Biological_Process_2021,regulation of cytosolic calcium ion concentration (GO:0051480),2/148,0.4088374927789938,0.5464560100043553,0,0,1.4405538055820086,1.2884853877887883,CAV2;CACNA1C
813,GO_Biological_Process_2021,positive regulation of intracellular protein transport (GO:0090316),2/148,0.4088374927789938,0.5464560100043553,0,0,1.4405538055820086,1.2884853877887883,BCL2;EFCAB7
814,GO_Biological_Process_2021,positive regulation of intracellular signal transduction (GO:1902533),6/546,0.4125260589515899,0.5477630040083724,0,0,1.170066788099575,1.0360425432414713,NTRK2;CAV2;BCL2;MAP3K7;ZDHHC17;TRIM22
815,GO_Biological_Process_2021,blood vessel morphogenesis (GO:0048514),1/56,0.4128360875798395,0.5477630040083724,0,0,1.9106382978723404,1.6903505811944235,ITGB8
816,GO_Biological_Process_2021,negative regulation of metabolic process (GO:0009892),1/56,0.4128360875798395,0.5477630040083724,0,0,1.9106382978723404,1.6903505811944235,NOVA1
817,GO_Biological_Process_2021,positive regulation of establishment of protein localization to mitochondrion (GO:1903749),1/56,0.4128360875798395,0.5477630040083724,0,0,1.9106382978723404,1.6903505811944235,BCL2
818,GO_Biological_Process_2021,tight junction assembly (GO:0120192),1/56,0.4128360875798395,0.5477630040083724,0,0,1.9106382978723404,1.6903505811944235,PARD6B
819,GO_Biological_Process_2021,mitochondrial transport (GO:0006839),1/56,0.4128360875798395,0.5477630040083724,0,0,1.9106382978723404,1.6903505811944235,BCL2
820,GO_Biological_Process_2021,brain development (GO:0007420),2/150,0.4154032521299532,0.5497821101198107,0,0,1.4209423327070383,1.2483057093981609,ATXN1;POMK
821,GO_Biological_Process_2021,nervous system development (GO:0007399),5/447,0.4155384388554445,0.5497821101198107,0,0,1.1907952980523313,1.0457328014152123,CHRM3;ATXN1;ADGRG6;WWP1;MTR
822,GO_Biological_Process_2021,regulation of mitotic nuclear division (GO:0007088),1/57,0.4184003558632383,0.5497821101198107,0,0,1.8764247720364744,1.6349598943406722,CAV2
823,GO_Biological_Process_2021,dicarboxylic acid metabolic process (GO:0043648),1/57,0.4184003558632383,0.5497821101198107,0,0,1.8764247720364744,1.6349598943406722,MTHFD2L
824,GO_Biological_Process_2021,positive regulation of cell junction assembly (GO:1901890),1/57,0.4184003558632383,0.5497821101198107,0,0,1.8764247720364744,1.6349598943406722,PTPRD
825,GO_Biological_Process_2021,renal system development (GO:0072001),1/57,0.4184003558632383,0.5497821101198107,0,0,1.8764247720364744,1.6349598943406722,PYGO1
826,GO_Biological_Process_2021,positive regulation of proteolysis (GO:0045862),1/57,0.4184003558632383,0.5497821101198107,0,0,1.8764247720364744,1.6349598943406722,ADAM9
827,GO_Biological_Process_2021,protein K48-linked ubiquitination (GO:0070936),1/57,0.4184003558632383,0.5497821101198107,0,0,1.8764247720364744,1.6349598943406722,KBTBD6
828,GO_Biological_Process_2021,cellular response to DNA damage stimulus (GO:0006974),4/350,0.4222194908409659,0.5523550197517041,0,0,1.2163724418059678,1.0487927857885733,TAOK3;AKTIP;MCM9;BCL2
829,GO_Biological_Process_2021,negative regulation of hydrolase activity (GO:0051346),1/58,0.423912170489589,0.5523550197517041,0,0,1.84341172079134,1.5820693798039756,RDX
830,GO_Biological_Process_2021,cellular iron ion homeostasis (GO:0006879),1/58,0.423912170489589,0.5523550197517041,0,0,1.84341172079134,1.5820693798039756,ATP6V1A
831,GO_Biological_Process_2021,nucleosome assembly (GO:0006334),1/58,0.423912170489589,0.5523550197517041,0,0,1.84341172079134,1.5820693798039756,NAP1L2
832,GO_Biological_Process_2021,eye development (GO:0001654),1/58,0.423912170489589,0.5523550197517041,0,0,1.84341172079134,1.5820693798039756,CACNA1C
833,GO_Biological_Process_2021,regulation of tumor necrosis factor-mediated signaling pathway (GO:0010803),1/58,0.423912170489589,0.5523550197517041,0,0,1.84341172079134,1.5820693798039756,TAX1BP1
834,GO_Biological_Process_2021,positive regulation of mitotic cell cycle phase transition (GO:1901992),1/58,0.423912170489589,0.5523550197517041,0,0,1.84341172079134,1.5820693798039756,RDX
835,GO_Biological_Process_2021,dephosphorylation (GO:0016311),2/153,0.4251834262621793,0.5533487652790086,0,0,1.3924992031731416,1.1909135156821835,PTPRD;PPP3CA
836,GO_Biological_Process_2021,phospholipid transport (GO:0015914),1/59,0.4293720233296841,0.554818006392751,0,0,1.8115370506236244,1.5315305740460652,ATP9A
837,GO_Biological_Process_2021,positive regulation of apoptotic signaling pathway (GO:2001235),1/59,0.4293720233296841,0.554818006392751,0,0,1.8115370506236244,1.5315305740460652,BCL2
838,GO_Biological_Process_2021,fatty acid oxidation (GO:0019395),1/59,0.4293720233296841,0.554818006392751,0,0,1.8115370506236244,1.5315305740460652,PECR
839,GO_Biological_Process_2021,response to reactive oxygen species (GO:0000302),1/59,0.4293720233296841,0.554818006392751,0,0,1.8115370506236244,1.5315305740460652,ADAM9
840,GO_Biological_Process_2021,selective autophagy (GO:0061912),1/59,0.4293720233296841,0.554818006392751,0,0,1.8115370506236244,1.5315305740460652,ACBD5
841,GO_Biological_Process_2021,mitotic DNA damage checkpoint signaling (GO:0044773),1/59,0.4293720233296841,0.554818006392751,0,0,1.8115370506236244,1.5315305740460652,TAOK3
842,GO_Biological_Process_2021,ubiquitin-dependent protein catabolic process (GO:0006511),4/354,0.4306668318248121,0.5558309763053328,0,0,1.202223938223938,1.0127780909265176,KBTBD6;RNF19A;WWP1;NFE2L2
843,GO_Biological_Process_2021,positive regulation of NF-kappaB transcription factor activity (GO:0051092),2/155,0.4316565199063786,0.556448215234763,0,0,1.374156792841914,1.154463612728904,MAP3K7;TRIM22
844,GO_Biological_Process_2021,regulation of cell population proliferation (GO:0042127),8/764,0.4347519160566446,0.5584900555477408,0,0,1.114034318454208,0.9279679929815704,NTRK2;GRK5;CCPG1;MAGI2;NAMPT;BCL2;SMARCA2;IFIT3
845,GO_Biological_Process_2021,adenylate cyclase-inhibiting G protein-coupled receptor signaling pathway (GO:0007193),1/60,0.4347804016993901,0.5584900555477408,0,0,1.7807428777497296,1.4832060277160146,CHRM3
846,GO_Biological_Process_2021,apical junction assembly (GO:0043297),1/60,0.4347804016993901,0.5584900555477408,0,0,1.7807428777497296,1.4832060277160146,PARD6B
847,GO_Biological_Process_2021,mitotic spindle organization (GO:0007052),2/157,0.4380909552783694,0.5613949750028855,0,0,1.356287735035363,1.1193832334796712,CEP126;MAP9
848,GO_Biological_Process_2021,"regulation of DNA-templated transcription, initiation (GO:2000142)",1/61,0.4401377883064901,0.5613949750028855,0,0,1.7509751773049644,1.4369683265067992,TNRC6B
849,GO_Biological_Process_2021,O-glycan processing (GO:0016266),1/61,0.4401377883064901,0.5613949750028855,0,0,1.7509751773049644,1.4369683265067992,GALNT13
850,GO_Biological_Process_2021,pattern recognition receptor signaling pathway (GO:0002221),1/61,0.4401377883064901,0.5613949750028855,0,0,1.7509751773049644,1.4369683265067992,MAP3K7
851,GO_Biological_Process_2021,iron ion homeostasis (GO:0055072),1/61,0.4401377883064901,0.5613949750028855,0,0,1.7509751773049644,1.4369683265067992,ATP6V1A
852,GO_Biological_Process_2021,protein lipidation (GO:0006497),1/61,0.4401377883064901,0.5613949750028855,0,0,1.7509751773049644,1.4369683265067992,ZDHHC17
853,GO_Biological_Process_2021,cellular response to growth factor stimulus (GO:0071363),2/158,0.4412934120159422,0.562209873856376,0,0,1.3475250239956122,1.102336500925882,NTRK2;MAGI2
854,GO_Biological_Process_2021,I-kappaB kinase/NF-kappaB signaling (GO:0007249),1/62,0.4454446613525643,0.566172653681764,0,0,1.7221834670387164,1.3926992126250894,MAP3K7
855,GO_Biological_Process_2021,stress-activated MAPK cascade (GO:0051403),1/62,0.4454446613525643,0.566172653681764,0,0,1.7221834670387164,1.3926992126250894,MAP3K7
856,GO_Biological_Process_2021,actin cytoskeleton reorganization (GO:0031532),1/63,0.4507014946724221,0.5721857948700062,0,0,1.6943205216197663,1.3502887955420633,CDC42BPA
857,GO_Biological_Process_2021,regulation of cilium assembly (GO:1902017),1/64,0.4559087575394071,0.575439359864124,0,0,1.6673421141506248,1.3096348430658042,DYNC2LI1
858,GO_Biological_Process_2021,regulation of extrinsic apoptotic signaling pathway (GO:2001236),1/64,0.4559087575394071,0.575439359864124,0,0,1.6673421141506248,1.3096348430658042,ZMYND11
859,GO_Biological_Process_2021,diterpenoid metabolic process (GO:0016101),1/64,0.4559087575394071,0.575439359864124,0,0,1.6673421141506248,1.3096348430658042,PECR
860,GO_Biological_Process_2021,regulation of transcription initiation from RNA polymerase II promoter (GO:0060260),1/64,0.4559087575394071,0.575439359864124,0,0,1.6673421141506248,1.3096348430658042,TNRC6B
861,GO_Biological_Process_2021,tRNA processing (GO:0008033),1/64,0.4559087575394071,0.575439359864124,0,0,1.6673421141506248,1.3096348430658042,TRNT1
862,GO_Biological_Process_2021,"G protein-coupled receptor signaling pathway, coupled to cyclic nucleotide second messenger (GO:0007187)",1/65,0.4610669150334794,0.581275554526565,0,0,1.6412067819148937,1.2706421403022687,CHRM3
863,GO_Biological_Process_2021,adenylate cyclase-modulating G protein-coupled receptor signaling pathway (GO:0007188),2/165,0.4634259891258896,0.5831547368489265,0,0,1.289196548669663,0.991532133318033,GRK5;ADGRG6
864,GO_Biological_Process_2021,negative regulation of signal transduction (GO:0009968),3/267,0.4636294553072806,0.5831547368489265,0,0,1.194220430107527,0.9179609803250616,BCL2;CXXC4;BEND6
865,GO_Biological_Process_2021,positive regulation of cell population proliferation (GO:0008284),5/474,0.4654693820613643,0.583659324856922,0,0,1.1206776675628072,0.8569922522367271,NTRK2;GRK5;CCPG1;NAMPT;BCL2
866,GO_Biological_Process_2021,central nervous system development (GO:0007417),3/268,0.4660679026993719,0.583659324856922,0,0,1.18965307364577,0.9082096385294935,ATXN1;POMK;WWP1
867,GO_Biological_Process_2021,ERBB signaling pathway (GO:0038127),1/66,0.4661764276660525,0.583659324856922,0,0,1.6158756137479542,1.233221913564407,ERBIN
