,Gene_set,Term,Overlap,P-value,Adjusted P-value,Old P-value,Old Adjusted P-value,Odds Ratio,Combined Score,Genes
286,GO_Biological_Process_2021,response to nitric oxide (GO:0071731),1/13,0.1161527159532597,0.4177697011463238,0,0,8.776152482269504,18.893734929477525,MTR
287,GO_Biological_Process_2021,intraciliary retrograde transport (GO:0035721),1/13,0.1161527159532597,0.4177697011463238,0,0,8.776152482269504,18.893734929477525,DYNC2LI1
288,GO_Biological_Process_2021,positive regulation of nuclear-transcribed mRNA poly(A) tail shortening (GO:0060213),1/13,0.1161527159532597,0.4177697011463238,0,0,8.776152482269504,18.893734929477525,TNRC6B
289,GO_Biological_Process_2021,sphingoid biosynthetic process (GO:0046520),1/13,0.1161527159532597,0.4177697011463238,0,0,8.776152482269504,18.893734929477525,ASAH1
290,GO_Biological_Process_2021,sphingosine biosynthetic process (GO:0046512),1/13,0.1161527159532597,0.4177697011463238,0,0,8.776152482269504,18.893734929477525,ASAH1
291,GO_Biological_Process_2021,spliceosomal tri-snRNP complex assembly (GO:0000244),1/13,0.1161527159532597,0.4177697011463238,0,0,8.776152482269504,18.893734929477525,PRPF3
292,GO_Biological_Process_2021,positive regulation of protein acetylation (GO:1901985),1/13,0.1161527159532597,0.4177697011463238,0,0,8.776152482269504,18.893734929477525,FAM161A
293,GO_Biological_Process_2021,pre-mRNA cleavage required for polyadenylation (GO:0098789),1/13,0.1161527159532597,0.4177697011463238,0,0,8.776152482269504,18.893734929477525,CPSF2
294,GO_Biological_Process_2021,myelination in peripheral nervous system (GO:0022011),1/13,0.1161527159532597,0.4177697011463238,0,0,8.776152482269504,18.893734929477525,ADGRG6
295,GO_Biological_Process_2021,"mRNA splicing, via spliceosome (GO:0000398)",5/274,0.1187424943139545,0.4177697011463238,0,0,1.974098917084209,4.206406110874,NOVA1;PRPF3;CPSF2;PPWD1;RBM6
296,GO_Biological_Process_2021,cellular response to reactive oxygen species (GO:0034614),2/63,0.1195208853855036,0.4177697011463238,0,0,3.462786008591216,7.355872176414121,IMPACT;NFE2L2
297,GO_Biological_Process_2021,positive regulation of Ras protein signal transduction (GO:0046579),2/63,0.1195208853855036,0.4177697011463238,0,0,3.462786008591216,7.355872176414121,ERBIN;MAPRE2
298,GO_Biological_Process_2021,plasma membrane bounded cell projection organization (GO:0120036),3/128,0.1212161532958154,0.4177697011463238,0,0,2.5401290322580645,5.360129319253891,ARMC2;FAM161A;FAM161B
299,GO_Biological_Process_2021,gene expression (GO:0010467),6/356,0.1221643581320255,0.4177697011463238,0,0,1.8230444964871195,3.832746769153245,ATXN1;THRB;NOVA1;CPSF2;MRPS6;RBM6
300,GO_Biological_Process_2021,protein secretion (GO:0009306),2/64,0.1226438163832368,0.4177697011463238,0,0,3.406762118337071,7.148991258211783,MIA2;MIA3
301,GO_Biological_Process_2021,negative regulation of intrinsic apoptotic signaling pathway (GO:2001243),2/64,0.1226438163832368,0.4177697011463238,0,0,3.406762118337071,7.148991258211783,BCL2;NFE2L2
302,GO_Biological_Process_2021,cellular response to insulin stimulus (GO:0032869),3/129,0.123288402982508,0.4177697011463238,0,0,2.5198412698412698,5.274604641328511,ATP6V1A;CAV2;NAMPT
303,GO_Biological_Process_2021,cAMP metabolic process (GO:0046058),1/14,0.124510492276309,0.4177697011463238,0,0,8.100654664484452,16.87662276492899,PDE4D
304,GO_Biological_Process_2021,regulation of intrinsic apoptotic signaling pathway in response to DNA damage by p53 class mediator (GO:1902165),1/14,0.124510492276309,0.4177697011463238,0,0,8.100654664484452,16.87662276492899,BCL2
305,GO_Biological_Process_2021,regulation of lamellipodium organization (GO:1902743),1/14,0.124510492276309,0.4177697011463238,0,0,8.100654664484452,16.87662276492899,TWF1
306,GO_Biological_Process_2021,COPII-coated vesicle cargo loading (GO:0090110),1/14,0.124510492276309,0.4177697011463238,0,0,8.100654664484452,16.87662276492899,MIA3
307,GO_Biological_Process_2021,regulation of nitric-oxide synthase biosynthetic process (GO:0051769),1/14,0.124510492276309,0.4177697011463238,0,0,8.100654664484452,16.87662276492899,NAMPT
308,GO_Biological_Process_2021,peptidyl-serine dephosphorylation (GO:0070262),1/14,0.124510492276309,0.4177697011463238,0,0,8.100654664484452,16.87662276492899,PPP3CA
309,GO_Biological_Process_2021,positive regulation of cyclase activity (GO:0031281),1/14,0.124510492276309,0.4177697011463238,0,0,8.100654664484452,16.87662276492899,CACNA1C
310,GO_Biological_Process_2021,positive regulation of glycogen biosynthetic process (GO:0045725),1/14,0.124510492276309,0.4177697011463238,0,0,8.100654664484452,16.87662276492899,EPM2AIP1
311,GO_Biological_Process_2021,synaptic membrane adhesion (GO:0099560),1/14,0.124510492276309,0.4177697011463238,0,0,8.100654664484452,16.87662276492899,PTPRD
312,GO_Biological_Process_2021,microvillus organization (GO:0032528),1/14,0.124510492276309,0.4177697011463238,0,0,8.100654664484452,16.87662276492899,RAPGEF6
313,GO_Biological_Process_2021,mRNA cleavage involved in mRNA processing (GO:0098787),1/14,0.124510492276309,0.4177697011463238,0,0,8.100654664484452,16.87662276492899,CPSF2
314,GO_Biological_Process_2021,NAD biosynthesis via nicotinamide riboside salvage pathway (GO:0034356),1/14,0.124510492276309,0.4177697011463238,0,0,8.100654664484452,16.87662276492899,NAMPT
315,GO_Biological_Process_2021,cellular response to type I interferon (GO:0071357),2/65,0.1257865596889854,0.4177697011463238,0,0,3.35251676428147,6.950333087264424,IFIT3;IFNAR1
316,GO_Biological_Process_2021,regulation of RNA metabolic process (GO:0051252),2/65,0.1257865596889854,0.4177697011463238,0,0,3.35251676428147,6.950333087264424,NOVA1;PTBP3
317,GO_Biological_Process_2021,type I interferon signaling pathway (GO:0060337),2/65,0.1257865596889854,0.4177697011463238,0,0,3.35251676428147,6.950333087264424,IFIT3;IFNAR1
318,GO_Biological_Process_2021,cell-cell junction assembly (GO:0007043),2/66,0.1289484673318831,0.4177697011463238,0,0,3.299966577540107,6.759461566542831,PARD6B;CDH8
319,GO_Biological_Process_2021,regulation of protein localization (GO:0032880),2/66,0.1289484673318831,0.4177697011463238,0,0,3.299966577540107,6.759461566542831,RABGAP1L;TRIM22
320,GO_Biological_Process_2021,defense response to virus (GO:0051607),3/133,0.1317049700454103,0.4177697011463238,0,0,2.44181141439206,4.950017960129075,BCL2;ZMYND11;IFIT3
321,GO_Biological_Process_2021,RNA metabolic process (GO:0016070),3/133,0.1317049700454103,0.4177697011463238,0,0,2.44181141439206,4.950017960129075,ATXN1;NOVA1;RBM6
322,GO_Biological_Process_2021,protein N-linked glycosylation (GO:0006487),2/67,0.132128901743807,0.4177697011463238,0,0,3.249033319621555,6.575969700566797,MGAT4A;UGGT2
323,GO_Biological_Process_2021,negative regulation of androgen receptor signaling pathway (GO:0060766),1/15,0.1327896508776999,0.4177697011463238,0,0,7.521656534954407,15.1861416186695,PIAS2
324,GO_Biological_Process_2021,regulation of cytoplasmic translation (GO:2000765),1/15,0.1327896508776999,0.4177697011463238,0,0,7.521656534954407,15.1861416186695,CPEB4
325,GO_Biological_Process_2021,central nervous system neuron development (GO:0021954),1/15,0.1327896508776999,0.4177697011463238,0,0,7.521656534954407,15.1861416186695,NTRK2
326,GO_Biological_Process_2021,neurotrophin TRK receptor signaling pathway (GO:0048011),1/15,0.1327896508776999,0.4177697011463238,0,0,7.521656534954407,15.1861416186695,NTRK2
327,GO_Biological_Process_2021,"regulation of nuclear-transcribed mRNA catabolic process, deadenylation-dependent decay (GO:1900151)",1/15,0.1327896508776999,0.4177697011463238,0,0,7.521656534954407,15.1861416186695,TNRC6B
328,GO_Biological_Process_2021,regulation of nuclear-transcribed mRNA poly(A) tail shortening (GO:0060211),1/15,0.1327896508776999,0.4177697011463238,0,0,7.521656534954407,15.1861416186695,TNRC6B
329,GO_Biological_Process_2021,engulfment of apoptotic cell (GO:0043652),1/15,0.1327896508776999,0.4177697011463238,0,0,7.521656534954407,15.1861416186695,XKR4
330,GO_Biological_Process_2021,response to acidic pH (GO:0010447),1/15,0.1327896508776999,0.4177697011463238,0,0,7.521656534954407,15.1861416186695,IMPACT
331,GO_Biological_Process_2021,positive regulation of glycogen metabolic process (GO:0070875),1/15,0.1327896508776999,0.4177697011463238,0,0,7.521656534954407,15.1861416186695,EPM2AIP1
332,GO_Biological_Process_2021,positive regulation of lyase activity (GO:0051349),1/15,0.1327896508776999,0.4177697011463238,0,0,7.521656534954407,15.1861416186695,CACNA1C
333,GO_Biological_Process_2021,positive regulation of membrane protein ectodomain proteolysis (GO:0051044),1/15,0.1327896508776999,0.4177697011463238,0,0,7.521656534954407,15.1861416186695,ADAM9
334,GO_Biological_Process_2021,"positive regulation of nuclear-transcribed mRNA catabolic process, deadenylation-dependent decay (GO:1900153)",1/15,0.1327896508776999,0.4177697011463238,0,0,7.521656534954407,15.1861416186695,TNRC6B
335,GO_Biological_Process_2021,microvillus assembly (GO:0030033),1/15,0.1327896508776999,0.4177697011463238,0,0,7.521656534954407,15.1861416186695,RAPGEF6
336,GO_Biological_Process_2021,protein kinase A signaling (GO:0010737),1/15,0.1327896508776999,0.4177697011463238,0,0,7.521656534954407,15.1861416186695,RDX
337,GO_Biological_Process_2021,negative regulation of cellular catabolic process (GO:0031330),2/69,0.1385428514202368,0.4177697011463238,0,0,3.151727991060739,6.229628659692471,BCL2;EIF4G3
338,GO_Biological_Process_2021,RNA 3'-end processing (GO:0031123),2/69,0.1385428514202368,0.4177697011463238,0,0,3.151727991060739,6.229628659692471,CPSF2;RPRD2
339,GO_Biological_Process_2021,positive regulation of MAP kinase activity (GO:0043406),2/69,0.1385428514202368,0.4177697011463238,0,0,3.151727991060739,6.229628659692471,TAOK3;MAP3K7
340,GO_Biological_Process_2021,negative regulation of anoikis (GO:2000811),1/16,0.1409909273153888,0.4177697011463238,0,0,7.019858156028369,13.752321465591514,BCL2
341,GO_Biological_Process_2021,activation of NF-kappaB-inducing kinase activity (GO:0007250),1/16,0.1409909273153888,0.4177697011463238,0,0,7.019858156028369,13.752321465591514,MAP3K7
342,GO_Biological_Process_2021,regulation of activin receptor signaling pathway (GO:0032925),1/16,0.1409909273153888,0.4177697011463238,0,0,7.019858156028369,13.752321465591514,MAGI2
343,GO_Biological_Process_2021,ceramide catabolic process (GO:0046514),1/16,0.1409909273153888,0.4177697011463238,0,0,7.019858156028369,13.752321465591514,ASAH1
344,GO_Biological_Process_2021,regulation of Rac protein signal transduction (GO:0035020),1/16,0.1409909273153888,0.4177697011463238,0,0,7.019858156028369,13.752321465591514,KBTBD6
345,GO_Biological_Process_2021,glutamine family amino acid catabolic process (GO:0009065),1/16,0.1409909273153888,0.4177697011463238,0,0,7.019858156028369,13.752321465591514,GLS
346,GO_Biological_Process_2021,Golgi to endosome transport (GO:0006895),1/16,0.1409909273153888,0.4177697011463238,0,0,7.019858156028369,13.752321465591514,MON2
347,GO_Biological_Process_2021,retrograde axonal transport (GO:0008090),1/16,0.1409909273153888,0.4177697011463238,0,0,7.019858156028369,13.752321465591514,DST
348,GO_Biological_Process_2021,sphingolipid catabolic process (GO:0030149),1/16,0.1409909273153888,0.4177697011463238,0,0,7.019858156028369,13.752321465591514,ASAH1
349,GO_Biological_Process_2021,positive regulation of small molecule metabolic process (GO:0062013),1/16,0.1409909273153888,0.4177697011463238,0,0,7.019858156028369,13.752321465591514,PPM1K
350,GO_Biological_Process_2021,positive regulation of syncytium formation by plasma membrane fusion (GO:0060143),1/16,0.1409909273153888,0.4177697011463238,0,0,7.019858156028369,13.752321465591514,ADAM9
351,GO_Biological_Process_2021,protein localization to endoplasmic reticulum (GO:0070972),1/16,0.1409909273153888,0.4177697011463238,0,0,7.019858156028369,13.752321465591514,MIA3
352,GO_Biological_Process_2021,protein localization to microtubule organizing center (GO:1905508),1/16,0.1409909273153888,0.4177697011463238,0,0,7.019858156028369,13.752321465591514,CEP83
353,GO_Biological_Process_2021,fatty acid catabolic process (GO:0009062),2/70,0.1417751420882622,0.4177697011463238,0,0,3.1052217678515257,6.066091038197726,PECR;ACBD5
354,GO_Biological_Process_2021,positive regulation of cellular catabolic process (GO:0031331),3/141,0.1491140333473516,0.4177697011463238,0,0,2.29932211313698,4.375711016431739,RDX;ADAM9;TRIM22
355,GO_Biological_Process_2021,regulation of cardiac muscle contraction by regulation of the release of sequestered calcium ion (GO:0010881),1/17,0.1491150502899167,0.4177697011463238,0,0,6.580784574468085,12.52347733311014,CACNA1C
356,GO_Biological_Process_2021,negative regulation of intrinsic apoptotic signaling pathway by p53 class mediator (GO:1902254),1/17,0.1491150502899167,0.4177697011463238,0,0,6.580784574468085,12.52347733311014,BCL2
357,GO_Biological_Process_2021,regulation of cellular respiration (GO:0043457),1/17,0.1491150502899167,0.4177697011463238,0,0,6.580784574468085,12.52347733311014,IFNAR1
358,GO_Biological_Process_2021,regulation of cellular response to growth factor stimulus (GO:0090287),1/17,0.1491150502899167,0.4177697011463238,0,0,6.580784574468085,12.52347733311014,ZDHHC17
359,GO_Biological_Process_2021,cell communication by electrical coupling involved in cardiac conduction (GO:0086064),1/17,0.1491150502899167,0.4177697011463238,0,0,6.580784574468085,12.52347733311014,CACNA1C
360,GO_Biological_Process_2021,regulation of leukocyte migration (GO:0002685),1/17,0.1491150502899167,0.4177697011463238,0,0,6.580784574468085,12.52347733311014,MIA3
361,GO_Biological_Process_2021,regulation of metal ion transport (GO:0010959),1/17,0.1491150502899167,0.4177697011463238,0,0,6.580784574468085,12.52347733311014,BCL2
362,GO_Biological_Process_2021,diol biosynthetic process (GO:0034312),1/17,0.1491150502899167,0.4177697011463238,0,0,6.580784574468085,12.52347733311014,ASAH1
363,GO_Biological_Process_2021,regulation of steroid biosynthetic process (GO:0050810),1/17,0.1491150502899167,0.4177697011463238,0,0,6.580784574468085,12.52347733311014,ASAH1
364,GO_Biological_Process_2021,positive regulation of dendrite extension (GO:1903861),1/17,0.1491150502899167,0.4177697011463238,0,0,6.580784574468085,12.52347733311014,ITSN2
365,GO_Biological_Process_2021,positive regulation of heart rate (GO:0010460),1/17,0.1491150502899167,0.4177697011463238,0,0,6.580784574468085,12.52347733311014,PDE4D
366,GO_Biological_Process_2021,snRNA metabolic process (GO:0016073),1/17,0.1491150502899167,0.4177697011463238,0,0,6.580784574468085,12.52347733311014,RBM7
367,GO_Biological_Process_2021,membrane depolarization during cardiac muscle cell action potential (GO:0086012),1/17,0.1491150502899167,0.4177697011463238,0,0,6.580784574468085,12.52347733311014,CACNA1C
368,GO_Biological_Process_2021,negative regulation of amyloid-beta formation (GO:1902430),1/17,0.1491150502899167,0.4177697011463238,0,0,6.580784574468085,12.52347733311014,NTRK2
369,GO_Biological_Process_2021,regulation of cell growth (GO:0001558),4/217,0.1503206172391251,0.4177697011463238,0,0,1.989392209110519,3.769868032750272,CAPRIN2;BCL2;SMARCA2;CXCL16
370,GO_Biological_Process_2021,neurotransmitter transport (GO:0006836),2/73,0.1515661358846441,0.4177697011463238,0,0,2.973563304963471,5.610320635932044,STXBP3;GLS
371,GO_Biological_Process_2021,response to molecule of bacterial origin (GO:0002237),2/73,0.1515661358846441,0.4177697011463238,0,0,2.973563304963471,5.610320635932044,ERBIN;IFNAR1
372,GO_Biological_Process_2021,negative regulation of programmed cell death (GO:0043069),6/381,0.1531477107345973,0.4177697011463238,0,0,1.6993224043715849,3.1885276610754456,DNAJC3;GRK5;BCL2;TAX1BP1;HIPK3;IFIT3
373,GO_Biological_Process_2021,negative regulation of DNA-binding transcription factor activity (GO:0043433),3/143,0.1535781081807438,0.4177697011463238,0,0,2.2662442396313365,4.245912814980434,NWD1;TAX1BP1;ERBIN
374,GO_Biological_Process_2021,cellular response to amino acid starvation (GO:0034198),2/74,0.1548592468071058,0.4177697011463238,0,0,2.9321152703505646,5.469094757064261,ATP6V1A;IMPACT
375,GO_Biological_Process_2021,regulation of peptide hormone secretion (GO:0090276),2/74,0.1548592468071058,0.4177697011463238,0,0,2.9321152703505646,5.469094757064261,ITPR2;CACNA1C
376,GO_Biological_Process_2021,negative regulation of cell migration (GO:0030336),3/144,0.155825954567429,0.4177697011463238,0,0,2.250057195149852,4.182891360101145,MAGI2;MIA3;SCAI
377,GO_Biological_Process_2021,protein O-linked mannosylation (GO:0035269),1/18,0.157162741797235,0.4177697011463238,0,0,6.193366708385482,11.46066058904648,TMTC3
378,GO_Biological_Process_2021,negative regulation of leukocyte cell-cell adhesion (GO:1903038),1/18,0.157162741797235,0.4177697011463238,0,0,6.193366708385482,11.46066058904648,MIA3
379,GO_Biological_Process_2021,regulation of cellular protein catabolic process (GO:1903362),1/18,0.157162741797235,0.4177697011463238,0,0,6.193366708385482,11.46066058904648,RDX
380,GO_Biological_Process_2021,cell migration involved in sprouting angiogenesis (GO:0002042),1/18,0.157162741797235,0.4177697011463238,0,0,6.193366708385482,11.46066058904648,MIA3
381,GO_Biological_Process_2021,regulation of dendrite extension (GO:1903859),1/18,0.157162741797235,0.4177697011463238,0,0,6.193366708385482,11.46066058904648,ITSN2
382,GO_Biological_Process_2021,regulation of early endosome to late endosome transport (GO:2000641),1/18,0.157162741797235,0.4177697011463238,0,0,6.193366708385482,11.46066058904648,RDX
383,GO_Biological_Process_2021,negative regulation of Rho protein signal transduction (GO:0035024),1/18,0.157162741797235,0.4177697011463238,0,0,6.193366708385482,11.46066058904648,SCAI
384,GO_Biological_Process_2021,cellular response to pH (GO:0071467),1/18,0.157162741797235,0.4177697011463238,0,0,6.193366708385482,11.46066058904648,IMPACT
385,GO_Biological_Process_2021,regulation of oxidative stress-induced intrinsic apoptotic signaling pathway (GO:1902175),1/18,0.157162741797235,0.4177697011463238,0,0,6.193366708385482,11.46066058904648,NFE2L2
386,GO_Biological_Process_2021,embryonic axis specification (GO:0000578),1/18,0.157162741797235,0.4177697011463238,0,0,6.193366708385482,11.46066058904648,CXXC4
387,GO_Biological_Process_2021,regulation of presynapse assembly (GO:1905606),1/18,0.157162741797235,0.4177697011463238,0,0,6.193366708385482,11.46066058904648,PTPRD
388,GO_Biological_Process_2021,regulation of presynapse organization (GO:0099174),1/18,0.157162741797235,0.4177697011463238,0,0,6.193366708385482,11.46066058904648,PTPRD
389,GO_Biological_Process_2021,regulation of spindle organization (GO:0090224),1/18,0.157162741797235,0.4177697011463238,0,0,6.193366708385482,11.46066058904648,MAP9
390,GO_Biological_Process_2021,positive regulation of cell adhesion mediated by integrin (GO:0033630),1/18,0.157162741797235,0.4177697011463238,0,0,6.193366708385482,11.46066058904648,ADAM9
391,GO_Biological_Process_2021,G protein-coupled acetylcholine receptor signaling pathway (GO:0007213),1/18,0.157162741797235,0.4177697011463238,0,0,6.193366708385482,11.46066058904648,CHRM3
392,GO_Biological_Process_2021,regulation of transforming growth factor beta production (GO:0071634),1/18,0.157162741797235,0.4177697011463238,0,0,6.193366708385482,11.46066058904648,ITGB8
393,GO_Biological_Process_2021,release of cytochrome c from mitochondria (GO:0001836),1/18,0.157162741797235,0.4177697011463238,0,0,6.193366708385482,11.46066058904648,BCL2
394,GO_Biological_Process_2021,response to axon injury (GO:0048678),1/18,0.157162741797235,0.4177697011463238,0,0,6.193366708385482,11.46066058904648,MTR
395,GO_Biological_Process_2021,response to interferon-alpha (GO:0035455),1/18,0.157162741797235,0.4177697011463238,0,0,6.193366708385482,11.46066058904648,IFNAR1
396,GO_Biological_Process_2021,rRNA catabolic process (GO:0016075),1/18,0.157162741797235,0.4177697011463238,0,0,6.193366708385482,11.46066058904648,DIS3L
397,GO_Biological_Process_2021,positive regulation of phosphoprotein phosphatase activity (GO:0032516),1/18,0.157162741797235,0.4177697011463238,0,0,6.193366708385482,11.46066058904648,MAGI2
398,GO_Biological_Process_2021,"synaptic transmission, glutamatergic (GO:0035249)",1/18,0.157162741797235,0.4177697011463238,0,0,6.193366708385482,11.46066058904648,CDH8
399,GO_Biological_Process_2021,T cell migration (GO:0072678),1/18,0.157162741797235,0.4177697011463238,0,0,6.193366708385482,11.46066058904648,CXCL16
400,GO_Biological_Process_2021,positive regulation of stress-activated protein kinase signaling cascade (GO:0070304),1/18,0.157162741797235,0.4177697011463238,0,0,6.193366708385482,11.46066058904648,TAOK3
401,GO_Biological_Process_2021,presynapse assembly (GO:0099054),1/18,0.157162741797235,0.4177697011463238,0,0,6.193366708385482,11.46066058904648,PTPRD
402,GO_Biological_Process_2021,protein localization to centrosome (GO:0071539),1/18,0.157162741797235,0.4177697011463238,0,0,6.193366708385482,11.46066058904648,CEP83
403,GO_Biological_Process_2021,response to amino acid starvation (GO:1990928),2/75,0.1581661406146077,0.4177697011463238,0,0,2.8918027983297927,5.332800363434916,ATP6V1A;IMPACT
404,GO_Biological_Process_2021,cell morphogenesis involved in neuron differentiation (GO:0048667),2/76,0.1614862669771164,0.4177697011463238,0,0,2.8525798525798525,5.201209182230431,PARD6B;ZDHHC17
405,GO_Biological_Process_2021,cellular response to hormone stimulus (GO:0032870),2/76,0.1614862669771164,0.4177697011463238,0,0,2.8525798525798525,5.201209182230431,THRB;RDX
406,GO_Biological_Process_2021,positive regulation of growth (GO:0045927),2/76,0.1614862669771164,0.4177697011463238,0,0,2.8525798525798525,5.201209182230431,BCL2;CXCL16
407,GO_Biological_Process_2021,water-soluble vitamin metabolic process (GO:0006767),2/76,0.1614862669771164,0.4177697011463238,0,0,2.8525798525798525,5.201209182230431,MTHFD2L;MTR
408,GO_Biological_Process_2021,regulation of I-kappaB kinase/NF-kappaB signaling (GO:0043122),4/224,0.1627788521149849,0.4177697011463238,0,0,1.9254054054054053,3.49530922248094,ZMYND11;MAP3K7;ZDHHC17;TRIM22
409,GO_Biological_Process_2021,regulation of organelle assembly (GO:1902115),2/77,0.1648190846691282,0.4177697011463238,0,0,2.814402852049911,5.0741062177156495,DYNC2LI1;RDX
410,GO_Biological_Process_2021,positive regulation of transferase activity (GO:0051347),3/148,0.1649186669642718,0.4177697011463238,0,0,2.1875417130144603,3.9426126728276953,EPM2AIP1;NTRK2;SERINC1
411,GO_Biological_Process_2021,actin filament capping (GO:0051693),1/19,0.1651347170981347,0.4177697011463238,0,0,5.848995271867612,10.534003466039604,TWF1
412,GO_Biological_Process_2021,barbed-end actin filament capping (GO:0051016),1/19,0.1651347170981347,0.4177697011463238,0,0,5.848995271867612,10.534003466039604,TWF1
413,GO_Biological_Process_2021,cardiac muscle cell contraction (GO:0086003),1/19,0.1651347170981347,0.4177697011463238,0,0,5.848995271867612,10.534003466039604,CACNA1C
414,GO_Biological_Process_2021,negative regulation of oxidative stress-induced intrinsic apoptotic signaling pathway (GO:1902176),1/19,0.1651347170981347,0.4177697011463238,0,0,5.848995271867612,10.534003466039604,NFE2L2
415,GO_Biological_Process_2021,regulation of exosomal secretion (GO:1903541),1/19,0.1651347170981347,0.4177697011463238,0,0,5.848995271867612,10.534003466039604,ATP9A
416,GO_Biological_Process_2021,negative regulation of RNA metabolic process (GO:0051253),1/19,0.1651347170981347,0.4177697011463238,0,0,5.848995271867612,10.534003466039604,PTBP3
417,GO_Biological_Process_2021,negative regulation of RNA splicing (GO:0033119),1/19,0.1651347170981347,0.4177697011463238,0,0,5.848995271867612,10.534003466039604,PTBP3
418,GO_Biological_Process_2021,regulation of leukocyte chemotaxis (GO:0002688),1/19,0.1651347170981347,0.4177697011463238,0,0,5.848995271867612,10.534003466039604,MTUS1
419,GO_Biological_Process_2021,regulation of mitochondrial membrane permeability (GO:0046902),1/19,0.1651347170981347,0.4177697011463238,0,0,5.848995271867612,10.534003466039604,BCL2
420,GO_Biological_Process_2021,endoplasmic reticulum mannose trimming (GO:1904380),1/19,0.1651347170981347,0.4177697011463238,0,0,5.848995271867612,10.534003466039604,UGGT2
421,GO_Biological_Process_2021,establishment or maintenance of apical/basal cell polarity (GO:0035088),1/19,0.1651347170981347,0.4177697011463238,0,0,5.848995271867612,10.534003466039604,ERBIN
422,GO_Biological_Process_2021,regulation of T cell cytokine production (GO:0002724),1/19,0.1651347170981347,0.4177697011463238,0,0,5.848995271867612,10.534003466039604,MAP3K7
423,GO_Biological_Process_2021,folic acid metabolic process (GO:0046655),1/19,0.1651347170981347,0.4177697011463238,0,0,5.848995271867612,10.534003466039604,MTHFD2L
424,GO_Biological_Process_2021,positive regulation of cellular protein catabolic process (GO:1903364),1/19,0.1651347170981347,0.4177697011463238,0,0,5.848995271867612,10.534003466039604,RDX
425,GO_Biological_Process_2021,heart trabecula morphogenesis (GO:0061384),1/19,0.1651347170981347,0.4177697011463238,0,0,5.848995271867612,10.534003466039604,ADGRG6
426,GO_Biological_Process_2021,sphingosine metabolic process (GO:0006670),1/19,0.1651347170981347,0.4177697011463238,0,0,5.848995271867612,10.534003466039604,ASAH1
427,GO_Biological_Process_2021,N-glycan processing (GO:0006491),1/19,0.1651347170981347,0.4177697011463238,0,0,5.848995271867612,10.534003466039604,MGAT4A
428,GO_Biological_Process_2021,negative regulation of amyloid precursor protein catabolic process (GO:1902992),1/19,0.1651347170981347,0.4177697011463238,0,0,5.848995271867612,10.534003466039604,NTRK2
429,GO_Biological_Process_2021,positive regulation of hydrolase activity (GO:0051345),3/149,0.1672163083200179,0.4177697011463238,0,0,2.172448077772868,3.885351794697963,CAV2;RAPGEF6;MAPRE2
